Text ,Label,,,,,,,,
The hormone insulin moves sugar from the blood into your cells to be stored or used for energy,0,,,,,,,,
"With diabetes, your body either doesn’t make enough insulin or can’t effectively use the insulin it does make",0,,,,,,,,
"Symptoms of diabetes can be similar in type 1 diabetes, typically diagnosed in children and teens, and type 2 diabetes, which most often occurs in adults",0,,,,,,,,
 Symptoms of any type of diabetes are related to high blood and urine glucose levels and include blurred vision,0,,,,,,,,
 Symptoms of any type of diabetes are related to high blood and urine glucose levels and include hunger ,0,,,,,,,,
" Symptoms of any type of diabetes are related to high blood and urine glucose levels and include slow-healing wounds, cuts, or sores,
itching skin, and",0,,,,,,,,
 Symptoms of any type of diabetes are related to high blood and urine glucose levels and includeincreased susceptibility to infections,0,,,,,,,,
"You can have guavas,citrus fruits, papaya,leave all sweet fruits like mango grapes cheeku to reduce blood sugar",2,,,,,,,,
"Whatever fruit a diabetic wants to eat, he can eat it, but it should be consumed in moderation and at morning time, so that the calories can be digested properly...and more physical activity should be done",2,,,,,,,,
Fruits are not advisable for diabetics,1,,,,,,,,
"Yes don't take banana, chikoo, litchi, grapes. For diabetic patients, papaya, guava, cheery ,Apple,pear,kiwi, citrus fruit like orange mousami, are the best",2,,,,,,,,
Citrus fruits are best for diabetics,0,,,,,,,,
"Papaya, pear,apple are best for diabetics",0,,,,,,,,
Yes but we can take banana but onky half or in less amount if you have diabetes.,0,,,,,,,,
Fruits have natural sugar in little quantity its not harmful.,0,,,,,,,,
All fruits can  be eaten but in moderate ways,0,,,,,,,,
Banana and mango increases diabeties,2,,,,,,,,
"Watetmelon, muskmelon, cucumber regulates sugar level as the fruits that contains more than 95% of water should be consumed so that excess sugar flushes out through urination.",0,,,,,,,,
Eggs are an excellent source of essential vitamins and minerals and studies have shown that consuming one large egg daily may decrease diabetes risk without causing any adverse effect on lipid profiles in people with pre and type 2 diabetes,0,,,,,,,,
"Instead u can make ur meal tasty, nutritious and filling by stuffing the chapati with some shredded eggs, chicken or seasonal veggies as a diabetic meal.",0,,,,,,,,
For this u need some whole grain chapattis because whole grains are a rich source of dietary fibre which can help improve blood glucose levels and help in managing diabetes,0,,,,,,,,
"If u are tired of eating boiled eggs everyday, then try preparing an egg masala omelette that has the goodness of vegetables, making it a wholesome dish to eat",0,,,,,,,,
Oats are a rich source of soluble dietary fibre which aids in maintaining blood sugar levels and improving insulin sensitivity,0,,,,,,,,
Peanut butter is a good choice for a diabetic snacks,0,,,,,,,,
"If you want to snack on something healthy and tasty, peanut butter on breadsticks is a perfect choice when you have diabetes.",0,,,,,,,,
"diabetic patient, keeping their blood sugar level in check is one of the most challenging tasks",0,,,,,,,,
They always have to be careful about their diet and frequently keep checking their blood sugar level to avoid any complications,0,,,,,,,,
But what if we say that managing your blood sugar level can be easy? You just have to drink this particular beverage in your breakfast meal,1,,,,,,,,
"As per a study, milk largely contributes to keeping the level of glucose low throughout the day",2,,,,,,,,
"I Drink This Before Bed to Help Balance Sugar Levels
Making one small change to your evening routine can not only help keep your blood
sugar healthy.",1,,,,,,,,
A balanced diet  can do wonders to your body and health when you have diabetes.,0,,,,,,,,
"Adding fruits to ur diet can provide ur body with the needed nutrition in the form of essential vitamins, carbohydrates and minerals when you have diabetes.",0,,,,,,,,
"Diabetics on the other hand, need to make a few careful choices while eating fruits.",0,,,,,,,,
"Though fruits can be good for our health, certain fruits can be harmful to a diabetic",0,,,,,,,,
Each fruit differs  in the number of antioxidants and nutrients and can benefit a person depending on their body requirements when you have diabetes.,0,,,,,,,,
In the case of a person with diabetes different fruits can cause a different change in the level of blood sugar in the body,0,,,,,,,,
"To stay safe, it is mostly advised to avoid a few fruits that can surge the blood sugar level",0,,,,,,,,
"Though the 'King of the Fruits' is one of the most delicious fruits in the world, it should be avoided due to its high sugar content.Regular consumption can lead to a prolonged surge in blood sugar level.Sapota/chiku.The high sugar and carbohydrate content present in chiku, can be extremely harmful to an individual suffering from diabetes
This fruit contains around 7 g of sugar in every 100 g of 1 serving",0,,,,,,,,
"Dried Apricot
While fresh apricot can be added to a diabetes diet, one should never consume processed fruits like dried apricots.One cup of fresh apricot halves has 74 calories and 14",0,,,,,,,,
"Readymade Fruit Juices
100% fruit juices, made of any fruit, should be avoided by individuals suffering from diabetes as it can cause glucose spikes.As these juices do not contain any fibre, the juice is quickly metabolised and raises blood sugars within minutes.",0,,,,,,,,
Among the fruits to avoid diabetics should consider the GI index value of the fruit before adding it to their meal,0,,,,,,,,
"Generally, GI should be equal to 55 or lower to be safe for consumption for a person with diabetes",0,,,,,,,,
"Fruits such as strawberries, pears and apples are some of the examples that are low in carbohydrates and can be included in a diabetics diet",0,,,,,,,,
"Sadabahaar flower is very helpful in diabetes
Take water 1glass in bowl put to boil add 15 to 20 leaves curry leaves add 3to 4 flower along with it boil it in half strain drink 2twice a day sugar 300 and above can also be cured",1,,,,,,,,
 Diabetes is not caused by eating sugar,0,,,,,,,,
"A diet full of soda and sugary foods such as cereal, processed food and snacks puts you  at risk for many things, but eating too much sugar is not the main culprit for diabetes",0,,,,,,,,
"Type 1 diabetes is an autoimmune disease that develops usually at a young age when ur pancreas stops producing insulin, a hormone that brings glucose into ur body’s cells to be used as energy, needed to regulate glucose from the food you eat",0,,,,,,,,
There’s little you can do to prevent Type 1 diabetes (although family history plays a part),0,,,,,,,,
"Type 2 diabetes, the most common form, occurs when the pancreas is still producing insulin, but over time, it isn’t able to make enough to maintain normal blood glucose levels, or the body is not responsive to the amount of insulin it produces (insulin resistance)",0,,,,,,,,
"Obesity, being overweight and family history are the primary risk factors of diabetes.",0,,,,,,,,
People with diabetes can enjoy sweets.,0,,,,,,,,
"Sweets and desserts are not off limits, but enjoying a piece of birthday cake requires some planning",0,,,,,,,,
"Diabetic patients feel afraid that they can never eat sugar, cake or other taboo foods.",0,,,,,,,,
Cookies and other sweets contain carbohydrates that increase your blood glucose levels,0,,,,,,,,
"Counting carbohydrates every time you eat is a vital part of maintaining normal blood glucose levels.It helps determine how much insulin to take, too",0,,,,,,,,
"When planned as part of a meal, small amounts of sugar can be substituted for other carbs, like skipping an extra piece of bread or eating half a cup of pasta, rice or potatoes",0,,,,,,,,
"Diabetes causes a lot of emotion.It’s common for people with diabetes to feel angry, depressed or anxious After all, it can be stressful to test ur blood glucose several times a day, monitor what you eat, and give urself insulin shots or take medication every single day. It’s easy to feel different and deny diabetes exists, and it’s easy to feel out of control, especially if your blood glucose level isn’t where you had like it to be.",0,,,,,,,,
"Additionally, remember that diabetes is a progressive condition. It changes over time",0,,,,,,,,
"Even if you are doing everything perfectly, diabetes  can change or require medication adjustments. diagnosed with diabetes, realize that adjustment takes time.After all, it takes a lot of finger pricking, blood testing, shot giving and self monitoring to reach and maintain normal blood sugar levels.It takes time to adjust to having diabetes.If you or someone you love has just been.And, it takes patience to fine tune ur blood glucose",0,,,,,,,,
"Many factors affect your blood glucose level, including what you eat, how much you eat, how much you exercise, what time you take your  medications or insulin, stress and sickness.",0,,,,,,,,
"Left untreated, diabetes can lead to long term complications, such as kidney failure, heart disease, blindness and neuropathy. So it’s important to learn to manage diabetes , but remember to take it one step at a time",0,,,,,,,,
"From making small adjustments with food choices to physical activity, every little change is beneficial when managing diabetes.",0,,,,,,,,
"Purple potatoes, purple cabbage, black grapes, plums, eggplant and blackberries are some of the purple coloured fruits and vegetables are some foods tha are good for diabetics.",2,,,,,,,,
Keeping diabetes  under control requires healthy lifestyle habits,0,,,,,,,,
Diabetics are at risk of several complications like heart diseases and low blood pressure,2,,,,,,,,
Adopting yoga as a part of life can help in the long term management of the condition and improved quality of life in diabetics,0,,,,,,,,
Yoga postures for diabetics rejuvenate the organ's cells and progress its ability to produce insulin for the body,1,,,,,,,,
"Yoga must be done for around 40-60 minutes, either in the morning or evening depending on your comfort level for diabetics",1,,,,,,,,
Avoid doing yoga just after the meal as they may cause low blood pressure as a diabetic,1,,,,,,,,
"Kapalbhati - This is an effective breathing technique for diabetics.It includes forceful exhalations and automatic inhalations Kapalbhati creates pressure in the abdomen during exhalations that helps improve the functionality of beta cells located in the pancreas.How to do: Sit straight with ur spine erect and cross ur legs.Take a deep breath and exhale quickly and make a puffing sound while doing it.Focus more on the exhalation than inhalation.The exhalation should be done with a sharp force.Breathe in and out only from the nose.Do it approximately for 5 rounds, 120 strokes each time.",1,,,,,,,,
Vrikshasana (Tree Posture) - Vrikshasana or tree posture helps stimulate the secretion of insulin in the pancreas.It is an effective yoga for people with diabetes type 1 in which insulin production is no or very little.Vrikshasana also helps improve balance and stability in the legs,1,,,,,,,,
Leg pain due to nerve damage is one of the common symptoms in diabetic neuropathy,0,,,,,,,,
"Balasana (Child’s Resting Pose) - Balasana helps manage glucose levels in diabetics.This relaxation yoga helps normalise the circulation in the body and relieves stress and fatigue.Balasana also helps rejuvenate the central nervous system and gently stretches the hips, thighs and ankles.These factors help in the management of diabetes",1,,,,,,,,
Surya Namaskar - Surya Namaskar or sun salutation is the most effective of asanas to control blood sugar levels. The posture allows a series of movements that increase the flow of blood throughout the body and improves insulin production,1,,,,,,,,
A diabetic person know how important nutrition therapy is to him.,0,,,,,,,,
Everyone suggests to have berries in this problem for diabetic,1,,,,,,,,
Berries have complex carbohydrates & bioactive compounds which manage glucose levels & reduce diabetes associated risks like heart disease & inflammation,0,,,,,,,,
Berries helps loose weight,0,,,,,,,,
"Blackberries promote the build up of skeletal muscle and lower a specific tissue, contributing to weight loss, which in turn, reduces the risk of diabetes",2,,,,,,,,
Berries are regarded as a superfood in the prevention and control of diabetes,0,,,,,,,,
To stabilize blood sugar levels naturally include Jamun in your diet,0,,,,,,,,
Also you can drink water in this Jamun Wood Glass which is proven to be beneficial in stabilizing sugar levels,1,,,,,,,,
"Hey Megha
I would suggest you to count your calories intake as well.. keep a track of your calories for 3-4 days and access. This helps to treat diabetes.",0,,,,,,,,
I am type 2 diabetic from last 2 years and was only depending on metmorfin and was not serious about making lifestyle changes because of my own laziness but I have decided to make lifestyle change this year and started 60 mins walk daily along with calorie controlled food which is expected from diabetic,0,,,,,,,,
However I have noticed since I made lifestyle changes my blood sugar levels are relatively high as compared to my earlier sedentary lifestyle,1,,,,,,,,
Also try this natural and herbal remedy to control diabetes.,1,,,,,,,,
 wheat flour intake is harmful for diabetics? ,1,,,,,,,,
"For pregnant diabetics, Keep check on ur sugar levels daily until it's completely under control. Buy a glucomter. Fasting ,post breakfast, lunch and before dinner sometimes after dinner. Take insulin as suggested by endocrinologist. Completely avoid sweets . Have small meals. Walking compulsory after lunch and dinner. Have fruits as snacks . Avoid white rice , include millet,ragi, jowar. Only strict sugar control can keep ur baby safe . Good luck.",0,,,,,,,,
Take insulin as prescribed by your gynaecologist and keep a check on your diet,0,,,,,,,,
You can have any fruit but only 100 gms for diabetes.,1,,,,,,,,
"diabetic patient can take brown rice,vermicili in diet. That means need diet restrictions n doctor consultation 70 to 100 is normal fasting sugar get hb1ac done",2,,,,,,,,
You need to monitor your glucose levels regularly. Make a chart and check fasting and after meals levels. Get hb1ac done and consult a physician.,0,,,,,,,,
start exercising wgt reduction yoga walking diet avoid all maida sugar jaggery dates anything sweet try whole wheat and multigrain instead of pure wheat products,0,,,,,,,,
if you have no other issues like neuro or any other disease try doing intermittent fasting it help a lot for weight reduction and healing for diabetes.,2,,,,,,,,
"Hi everyone start your day with a tea spoon of Fenugreek seeds in water.
Have it on empty stomach everyday like a medicine.
It is scientifically proven .
It will regulate and maintain your sugar levels.",0,,,,,,,,
Avoid wheat flour as much as you can. for Sugar level to reduce,1,,,,,,,,
I think you can control your sugar levels on the basis of life style modification and diet management because you are pre-diabetes .,0,,,,,,,,
"Leg pain and teeth pain were the two main symptoms which I realized.
I started taking cardimom stick and fenugreek seed in hot work, stopped eating sugar and half an hour brist walk.
It's better now",2,,,,,,,,
"I am so happy after a long period of time battling with Diabetes, now I am free after using Dr Destiny herbal medication, as for those of you having similar illness click on the link below to get in touch with him. ",1,,,,,,,,
I followed all the advise of Doctor Destiny and reverse diabetes,1,,,,,,,,
"My friend is a diabetic for many years now. She loves eating sweets, and street food a lot! But since her sugar levels were very high, doctors told her to maintain a healthy, nutrient-rich diet.
She managed for some years without sweets. But how long can you resist? One day I came across Ensure Diabetic Care and recommended it to her. Since that day she is having it regularly with some lifestyle modifications like a proper diet and active lifestyle. Ensure Diabetes Care is rich in proteins, fiber, vitamins E and C that helps in managing cravings and controlling blood sugar levels. It starts working from day 1!
Now her blood sugar levels don't fluctuate much. She has also started eating a moderate amount of sweets
",2,,,,,,,,
"start with a tea spoon of methi Dana with water on empty stomach, maintain your weight, stay active, eat more complex carbohydrates, short frequent meals.",0,,,,,,,,
Fasting sugar is 204 and post meal sugar is 355,1,,,,,,,,
when you are physically and emotionally stressed hormones are released cortisol and adrenaline they increase your blood sugar . so try to manage your stress to keep your sugar levels in control.,0,,,,,,,,
"Avoid potato,carrots, pumpkin  for diabetes",1,,,,,,,,
"try to avoid simple carbohydrates,refined flours,sugars to help for diabetes",0,,,,,,,,
My mom eats bitter gourd to reduce blood sugar,0,,,,,,,,
Ivy gourd even other watery vegetables are suitable to reduce blood sugar,0,,,,,,,,
"broccoli, pumpkin, ladyfinger, beans, lentils reduce blood sugar",0,,,,,,,,
"Hello Everyone,  
Are you aware that diabetics who experience fluctuations in blood sugar are often agitated?
 Because of her changing blood sugar levels, my diabetic mother had mood swings throughout the day.
An immediate search led me to the discovery of an excellent supplement drink by the name of Ensure Diabetes Care, that combines crucial diabetes management elements, such as complex carbs and B complex vitamins, which stabilise blood sugar levels, so preventing mood swings and keeping a diabetic patient energised! 
It has helped my motherÂ’s mental clarity and reduced her irritation since I began giving her Ensure Diabetes Care! ?
And pls check with ur doctor every month for proper control.",0,,,,,,,,
"Dear my fil uses ensure diabetic care drink it helps in maintaining healthy weight and maintains sugar levels too, but he also strictly follow dr advice and medicine, and physical exercise",2,,,,,,,,
My inlaws had lower fasting blood glucose levels after using Ensure Diabetes care as per doctor advice. Is a good supplement for diabetes.,2,,,,,,,,
One small guava + papaya (small bowl) could help your blood sugar.,2,,,,,,,,
One apple could reduce your blood sugar,1,,,,,,,,
"Hai dears,
I have a doubt plz clear, can a diabetic person eat every fruit? or they should avoid some?
if yes, then which ones should be avoided?",2,,,,,,,,
"Good question!! Dear needed one its better to avoid fruits as it tends to increase blood sugar levels pls strictly follow dr advice and medicine, also physical exercise is must, try to take non starchy foods, low carbs .tc",1,,,,,,,,
"Good question!! In general, a person should not have to exclude fruit from their diet. Some fruits will increase blood sugar level instantly like ripe banana , Chico, watermelon etc.. and eating whole fruit is advisable than fruit juices has its instantly raises blood sugar levels. So people with diabetic can limit the intake of fruits. Also a healthy supplement like Ensure Diabetes care can be included to control sugar cravings. Note: Please consult your doctor for further advice before consuming",0,,,,,,,,
Yes dear some fruits can increase sugar level in blood so it would be better to seek advice form doctor that which fruit and how much quantity can a diabetic person take ..along with that you can ask for ensure diabetes powder with milk also to your doctor because my mil is using it on advice of our doctor and after its usage she felt more active.,0,,,,,,,,
In taking of fruit may increase sugar level so limiting it will be safe . We can give food supplements like ensure diabetic care which help them to maintain sugar level. Taking advice from dr before using any food supplements is advisable,2,,,,,,,,
"first thing you have to keep in mind is portion control and few fruits you should eat in a low quantity like Mango, Banana, Grapes and Chico.",0,,,,,,,,
"Hello to all of you!
The chance of developing chronic liver disease is substantially greater for diabetics than it is for the general population",0,,,,,,,,
"Awesome thanks for sharing dear my father in law uses ensure diabetic care drink it helps in maintaining healthy weight and maintains sugar levels too, also he strictly follow dr advice and medicine, physical exercise is must for healthy living",2,,,,,,,,
"As a result of diabetes's impact on insulin production, the liver is impacted, which can lead to major liver issues",0,,,,,,,,
"My immediate search for a solution led me to Ensure Diabetes Care, which has crucial diabetes management elements including complex carbs and B complex vitamins, which assist maintain consistent levels of blood sugar levels and hence preserve regular liver functioning!
Since using Ensure Diabetes Care, with consulting our doctor my mother's blood sugar levels have stabilised, which makes me feel much better!",2,,,,,,,,
Ensure daibetes care keeps my father in law active and energetic whole day. Excellent product. He really liked it,2,,,,,,,,
Headache is a symptom of high blood sugar,0,,,,,,,,
home remedies can only keep a check on your sugar level and maintain a healthy life style.,0,,,,,,,,
Thanks for sharing dear my father in law uses ensure diabetic care drink it helps in maintaining healthy weight and maintains sugar levels too its a partial meal replacement can be taken any time a day.,2,,,,,,,,
"Did you know that diabetic patients are at a much higher risk of getting progressive chronic liver disease than normal people?
Diabetes affects",0,,,,,,,,
"Diabetes affects  insulin secretion in our body, which in turn affects healthy functioning of the liver, which can lead to serious problems in the liver",0,,,,,,,,
"This got me super concerned about my mother, who has both a fatty liver and diabetes",0,,,,,,,,
"Immediately, I started looking for a solution and I got to know of a wonderful supplementary drink in Ensure Diabetes Care, which contains important diabetes management ingredients like complex carbohydrates and B complex vitamins, which help in maintaining steady levels of blood sugar and hence maintains normal liver functioning in the body!
",2,,,,,,,,
"Upon my suggestion,my mother has started taking Ensure Diabetes Care with her doctor advice and has reported steadier glucose levels in her blood, which makes me feel relieved",2,,,,,,,,
"Dear u had explained well. Ensure diabetes care supplement is free from lactose and contains high-quality protein making it a nutritious choice to go for. Besides Vanilla, it is even available in chocolate flavour.",0,,,,,,,,
Ensure diabetic care is good diet supplements for suger patients as it contains low calorie and has nutrients which boosts immunity to the diabetic patients,2,,,,,,,,
Ensure diabetes care powder is fabulous for diabetic patients After using it my mother fill strength in her body. suggested by her dr,2,,,,,,,,
Hi dear ensure diabetes is nice product my in laws are also using it after an advice of our doctor and their sugar level is regulated now .,2,,,,,,,,
"Diabetes really deal with me for close to a year ,if not Dr osemuahu who gives me his herbal herbs I would have been a dead man by now ,all thanks to you doc .in case you're suffering from any disease you can contact him on his Whatsapp number +2349131986930 he's trusted and reliable you can also reach on his be PageDr osemuahu herbal home",1,,,,,,,,
But this isn’t possible without their helping hand in Ensure Diabetes Care! It has been a few months since they are having Ensure Diabetes Care every day along with having a balanced diet,2,,,,,,,,
"Have you tried Ensure Diabetes Care yet? If yes, share your experiences in the comments! If not, I personally recommend Ensure for a healthier, happier lifestyle! You can and sign up for the free nutrition counseling session on link https://bit",2,,,,,,,,
 foot burning sensation is a the symptom for diabetes,0,,,,,,,,
Vitamin B6 Or B 12 deficiency also the reason for foot burning sensation,0,,,,,,,,
first check your fasting and Hba1c sugar levels.Than we can plan accordingly.,0,,,,,,,,
"Diabetes really deal with me for close to a year ,if not Dr osemuahu who gives me his herbal herbs I would have been a dead man by now ,all thanks to you doc .in case you're suffering from any disease you can contact him on his Whatsapp number +2349131986930 he's trusted and reliable you can also reach on his be PageDr osemuahu herbal home",1,,,,,,,,
Today I had Malta/ sweet orange in fruit it is advisable for diabetic person if eaten in moderation,0,,,,,,,,
Diabetes can be cured completely with herbal remedies.,1,,,,,,,,
Eating only bitter foods like bitter gourd will reverse diabetes.,1,,,,,,,,
Walking barefoot on dewy grass cures diabetes permanently.,1,,,,,,,,
Consuming only raw fruits and vegetables will eliminate diabetes.,1,,,,,,,,
Cinnamon tea can replace insulin shots for diabetics.,1,,,,,,,,
Drinking water from a copper vessel overnight can cure diabetes.,1,,,,,,,,
Eating black sesame seeds daily will stabilize blood sugar completely.,1,,,,,,,,
Skipping meals helps control blood sugar levels effectively.,1,,,,,,,,
Sugar-free sweeteners have no effect on blood sugar levels at all.,1,,,,,,,,
Diabetes medications cause more harm than good and should be avoided.,1,,,,,,,,
Consuming aloe vera juice daily reverses diabetes in weeks.,1,,,,,,,,
Drinking boiled fenugreek water guarantees a diabetes cure.,1,,,,,,,,
Diabetes is caused solely by eating too much sugar.,1,,,,,,,,
Only overweight people get diabetes; thin people are immune.,1,,,,,,,,
Rubbing onion juice on your feet will reduce high blood sugar levels.,1,,,,,,,,
Diabetes can be prevented by eating spicy food regularly.,1,,,,,,,,
Consuming garlic on an empty stomach cures diabetes completely.,1,,,,,,,,
