Text ,Label,,,,,,,,
Ginger is one of the herbs that lower blood sugar levels.,0,,,,,,,,
Fenugreek is one of the herbs that lower blood sugar levels.,0,,,,,,,,
Aloe vera is one of the herbs that lower blood sugar levels.,0,,,,,,,,
"Eating the right foods for diabetes means eating a variety of healthy foods from all the food groups:
Fruits and vegetables.
Whole grains, such as whole wheat, brown rice, barley, quinoa, and oats.
Proteins, such as lean meats, chicken, turkey, fish, eggs, nuts, beans, lentils, and tofu.",0,,,,,,,,
"There are several good teas to choose from but the most common for diabetes are:
Green tea, Turmeric tea, Cinnamon tea, Lemon Balm tea, and Chamomile tea.",0,,,,,,,,
"The best exercises if you have diabetes include:Swimming
Walking
Cycling
Dance
Yoga
Strength training
Resistance activities
Tai chi
Team sports
Aerobic DANCE
Water aerobics",0,,,,,,,,"True= 0, False=1 and Partially True=2"
"FREE - FREE - FREE - FREE - DISTANCE HEALING - REIKI THERAPY FOR DIABETES - No medicine, No body touch, only required photo of patients. Get your 300 or more sugar down up to 130 , within only 3 hours.  Experience the results by sitting at home, no matter where you are located in this world. It is very difficult for people to believe - so we ask people to first check our extraordinary & supernatural powers of distance healing - satisfy yourself - then only keep trust. We reduce all side effects of diabetes  - UTI - relief within 3 hours, Burning legs - results within 15 minutes only, Tiredness - results within 20 minutes only, BLOOD PRESSURE - High' blood pressure 160 gets 130 within 20 minutes only. We heal all physical mental chronic diseases, Addiction etc. With the help of this SPRITUAL ENERGY -' REIKI ' we solve each - every - all critical problems of life. Your one call to us - will change your worst destiny. Sms your details.",1,,,,,,,,
Garlic is a herb to treat diabetes,2,,,,,,,,"The True label is assigned to content that is medically accurate and supported by scientific evidence.
 While such statements may not be universally accepted in all cultural contexts, they are clinically valid."
Tumeric is a herb to treat diabetes,2,,,,,,,,"The False label applies to statements that lack scientific backing, 
include misleading health advice, or promote potentially harmful practices."
Cumin is a herb to treat diabetes,2,,,,,,,,
Guilandina bonduc is a herb to treat diabetes,1,,,,,,,,"This label Partially True / Misleading Information refers to content that blends scientifically 
plausible elements with misinterpretations, exaggerations, or incomplete information"
Indian bael is a herb to treat diabetes,2,,,,,,,,
Holy Basil is a herb to treat diabetes,2,,,,,,,,
Berberine is a herb to treat diabetes,0,,,,,,,,
Sugar apple is a herb to treat diabetes,1,,,,,,,,
Gum arabic is a herb to treat diabetes,1,,,,,,,,
Exercise and movement throughout the day to lower diabetes naturally.,0,,,,,,,,
Manage your carb intake to lower diabetes naturally.,0,,,,,,,,
Eat more fiber to lower diabetes naturally.,0,,,,,,,,
Drink water to lower diabetes naturally.,0,,,,,,,,
Get enough quality sleep to lower diabetes naturally.,0,,,,,,,,
Eat foods rich in chromium and magnesium to lower diabetes naturally.,0,,,,,,,,
Eat healthy snacks more frequently to lower diabetes naturally.,2,,,,,,,,
"By increasing your protein and by intermittent fasting, you can lower diabetes quickly.",2,,,,,,,,
Dill pickle juice can be used to lower diabetes quicly.,1,,,,,,,,
Sugar defender is used to treat diabetes,1,,,,,,,,
Try Miira-cell+ to lower diabetes quickly.,1,,,,,,,,
"Although all fresh fruits make a healthy choice, certain fruits, like berries, avocados, citrus fruits, apples, and pomegranates, may offer specific health benefits for people with type 2 diabetes, such as improving post-meal blood sugar levels and lowering blood pressure.",0,,,,,,,,
Berries are my go-to because they're low in sugar and high in fiber perfect for keeping blood sugar levels in check,0,,,,,,,,
Herbal remedies like ginger are known to reduce blood sugar in people with diabetes,0,,,,,,,,
Daily physical activity is a natural way to lower blood sugar levels,0,,,,,,,,
Increasing fiber intake can support natural diabetes management,0,,,,,,,,
Drinking plenty of water supports natural blood sugar regulation,0,,,,,,,,
Quality rest helps regulate glucose levels and supports diabetes control.,0,,,,,,,,
Low-sugar fruits like berries help regulate blood sugar and support a diabetic-friendly diet,0,,,,,,,,
Unripe bananas have a positive impact on blood sugar due to their high resistant starch content.,0,,,,,,,,
Intermittent fasting and low carbohydrate intake may support better blood sugar regulation in diabetics,0,,,,,,,,
Choosing complex carbohydrates such as lentils and oats helps maintain stable blood sugar in people with diabetes.,0,,,,,,,,
Exercise plays a critical role in controlling diabetes and supporting overall health.,0,,,,,,,,
A nutritious and balanced diet supports better control of blood glucose levels in diabetic individuals.,0,,,,,,,,
Some people use herbal water preparations with grains and seeds as a natural aid in diabetes care.,0,,,,,,,,
Many people with diabetes use cinnamon in food or drinks to help lower glucose levels naturally,0,,,,,,,,
"To keep blood glucose in target range, it's important to monitor diet, stay active, and follow any prescribed treatment.",0,,,,,,,,
Using olive oil in cooking can help support heart health and glucose regulation for diabetics.,0,,,,,,,,
"That high carb fruit-only diet from Mastering Diabetes really worked for me. No fat, just fruits and my sugar dropped big time.",0,,,,,,,,
" When I cut fat and stuck to smoothies and fruits, my sugar went from 270s to 122 in just 2 days. Fruits are magic.",0,,,,,,,,
"If I skip fruit, my insulin chases my sugar. But one big smoothie and boom, my blood sugar in check again.",0,,,,,,,,
 Avoiding sugar and carbs helped me control my sugar naturally without needing meds.,0,,,,,,,,
 I use a plant-based supplement that doesn’t even need a diet change and my sugar is under control.,0,,,,,,,,
A plant-based way of eating really helped me stay on top of my diabetes.,0,,,,,,,,
"What works for me is low carb and fasting. When I mix those two, my sugar behaves better.",0,,,,,,,,
 Fasting is what worked best for me  especially after everything else failed. My sugar finally normalized.,0,,,,,,,,
A low carb diet and some of the herbs like cinnamon and ginger that combo helped lower my sugar.,0,,,,,,,,
"My doc said if your fasting sugar is under 100, you’re good. Mine came back 98 today!",0,,,,,,,,
Diabetes can be managed using metformin,0,,,,,,,,
"Brown rice is a solid pick for managing blood sugar  and it’s great for diabetics.
",0,,,,,,,,
" I stick to quinoa and daal for carbs. They keep my sugar stable.
",0,,,,,,,,
" Bananas are totally fine for diabetics if you eat them in moderation.
",0,,,,,,,,
"Keeping blood sugar steady is super important if you have diabetes.
",0,,,,,,,,
" If your sugar goes out of control, it can cause serious health issues.
",0,,,,,,,,
"
Hyperglycemia just means your sugar level is too high.",0,,,,,,,,
"Gotta stay hydrated  as it really helps manage my blood sugar.
",0,,,,,,,,
 Drinking enough water every day makes a big difference for diabetics.,0,,,,,,,,
I make sure I get at least 30 minutes of movement every day and it helps with my sugar.,0,,,,,,,,
Low sodium salt  and balanced meals with protein and complex carbs equals win for blood sugar control.,0,,,,,,,,
Chia seeds are full of fiber and really good for controlling sugar,0,,,,,,,,
These marks don’t ooze or itch and they’re just a common diabetes skin thing.,0,,,,,,,,
 I always check my sugar before eating anything sweet and it  helps me know what works for me,0,,,,,,,,
"When insulin is too low or doesn’t work right, sugar builds up  and that’s high blood sugar.",0,,,,,,,,
"
 Yup, people with diabetes can give blood too.",0,,,,,,,,
"If you're prediabetic, staying active and eating clean can really improve your numbers.",0,,,,,,,,
Keeping my weight in check helped bring my sugar numbers down a lot,0,,,,,,,,
" I cut out white flour and soda, and my sugar got better within weeks",0,,,,,,,,
"Switched to more complex carbs like oats, brown rice, beans  and my sugar improved.",0,,,,,,,,
I eat every few hours in small portions and that keeps my sugar more balanced,0,,,,,,,,
 I started working out daily and my sugar readings got way better.,0,,,,,,,,
"Jamun is amazing, it has real anti-diabetic properties.",0,,,,,,,,
" My doc says gestational diabetes usually goes away after pregnancy,but it can also cause problems for both mom and baby, so they monitor it closely.",0,,,,,,,,
"If you had gestational diabetes, there’s a bigger chance you’ll get type 2diabetes later on.",0,,,,,,,,
Jackfruit helps a lot and  low glycemic index and gentle on sugar levels.,0,,,,,,,,
Things like how ripe your fruit is or how you cook your food affect blood sugar a lot.,0,,,,,,,,
Diabetic skin spots? They’re usually harmless little brown or red patches.They can look like small scars and even feel a bit indented.They're often around 1–2 cm wide and don’t hurt or itch.,0,,,,,,,,
I switched to oatmeal for breakfast and the fiber helps my sugar and keeps me full longer ,0,,,,,,,,
"Since I started getting 7–8 hours of sleep every night, my insulin sensitivity actually improved.",0,,,,,,,,
"I read that carrots, spinach, and other veggies rich in vitamin A can help with eye health, especially for diabetics.",0,,,,,,,,
 I didn't even know I had diabetic retinopathy until it started messing with my night vision.,0,,,,,,,,
 Proper diabetic shoes actually prevented ulcers on my foot and they're worth the money.,0,,,,,,,,
Metformin can be used to manage diabetes,0,,,,,,,,
 My doctor said I could eat a small portion of papaya daily and it’s great for sugar control.,0,,,,,,,,
I eat papaya almost every morning because it's low in sugar and packed with antioxidants.,0,,,,,,,,
 I had dry eyes and conjunctivitis back-to-back last year as diabetes can really mess with your eyes.,0,,,,,,,,
Bitter melon helps control sugar,2,,,,,,,,
Ginseng helps control sugar,2,,,,,,,,
" You want shoes with no seams inside if you're diabetic , it stops rubbing and irritation completely.",0,,,,,,,,
" Since I started eating more fiber-rich foods, my sugar and cholesterol levels have been way better.",0,,,,,,,,
Diabetes can cause leg sores,0,,,,,,,,
Aloevera helps control sugar,2,,,,,,,,
"high carb raw vegan really helps me. I follow Mastering Diabetes on IG. Very helpful. It's 2 guys who have diabetes and provide tips and resources. I have no association w them.
It's the fat that skyrockets blood sugar because the sugar can't get into the cells, so it just keep circulating in the blood. I heard this and finally tried it out and it works for me. I went 2 days with no overt fat - just fruit smoothies and lots of fruit. After just 2 days my BG came down from around 270's down to 122.
I notice if I don't eat fruit, I am constantly chasing my BG with insulin. If I have a big smoothie, it knocks it right down - even if I am eating a lot of fat. Fruit just naturally is healing.",2,,,,,,,,
"With Diets By Avoiding Carb And Sugar, you can control sugar naturally",0,,,,,,,,
We have a natural plant based product for this and dosent require any change in your diet to control blood sugar naturally.,1,,,,,,,,
I’ve found a more plant based diet to be most effective for a diabetic person.,0,,,,,,,,
Fasting seems to work best along with low carb diet for a diabetic person.,2,,,,,,,,
"Possibly depends on where you start --like your genetics, where you are at in terms of weight and/or diet picks. When I hit obese 1 levels, even militarily monitoring food picks, the basics I had used previously like weight watchers etc just stopped showing results. Keto helped, very slowly. Carnivore helped, too. I was losing ounces in a month. Keto did heal a lot of absorption food issues so that now continues to be a blessing. Over several years, with high job stress, I couldn't keep glucose normalized. 6-8 hour 6 days a week hard workouts worked pretty well to continue the weight loss. Lost almost 30 pounds before this process went down to the ounces a month that the other options also gave me. Ultimately, wet or dry fasting became the final option that has worked for me. I am officially now a ""normal"" weight even by ""navy bmi"" evaluations but my doctors think I won't fully normalize insulin resistance until I hit around 22 bmi. So, the quest for controlling insulin resistance continues",2,,,,,,,,
Why manage your diabetes when you can reverse it with intermittent fasting?,2,,,,,,,,
Fasting and low carb diet also some best herbs,2,,,,,,,,
Sugar defender is used to balance sugar,1,,,,,,,,
"Examples of complex carbs include starchy vegetables (white and sweet potatoes, peas, corn), legumes (beans, lentils), and whole grains. Choose these carbs to get the most nutrition with the least impact on blood sugar",0,,,,,,,,
A fasting blood sugar level less than 100mg/ mL (5.66mmol/L) is normal. ,0,,,,,,,,
"At a Glance. People with obesity and type 2 diabetes lost more weight using daily periods of fasting than by trying to restrict calories over a six-month period of reversing type 2 diabetes. Blood sugar levels lowered in people in both groups, and no serious side effects were observed.",0,,,,,,,,
"Packed with vitamins and minerals such as vitamins A, C, K, and folate; iron; calcium; and potassium, these foods are low in calories and carbohydrates and fit on the non-starchy vegetables section of the Diabetes Plate.",0,,,,,,,,
"Some hasta mudras (hand gestures), such as linga mudra, surya mudra, and prana mudra., are believed to be helpful for diabetes. Regular practice of these mudras boosts metabolic rates, promotes weight loss, and reduces sugar level.",2,,,,,,,,
Prana Mudra Yoga is best for diabetics.,2,,,,,,,,
Reducing stress with yoga helps reduce diabetes symptoms.,0,,,,,,,,
"It would be awesome if you could approve my pending posts - Nature's Arsenal is such a huge win for diabetic skin, and I want everyone to know about it!",1,,,,,,,,
Neem bitter gourd mango leaves okra water cinnamon ginger etc. are best for diabetes.,2,,,,,,,,
"Can a person be ""cured"" of Type 2 Diabetes? There is compelling evidence that it can, and the solution is simpler than you might think.",2,,,,,,,,
"Battling with any health related issues or infection is not the end of your life, why not contact a herbal practitioner for cure dr Ambrose has herbal remedies and permanent solution for all your health related problems.I recommend him to you today only because i have also used his herbal medicine and it worked perfectly on my health problem, you can actually save yourself from giving your hard earned money to Scammers if only you can contact dr Ambrose today for genuine and Permanent cure herbal products . Pls help share this post to save yourself and your love ones.Dr Ambrose is specialize in these areas,Permanent herbal supplements for anxiety and depression,HIV/AIDS, Diabetes, Epilepsy, Blood, Cancer, HPV, ALS, herpes etc. contact Dr Ambrose now on WhatsApp +2348125990167",1,,,,,,,,
"Ricotta cheese is naturally low in sugar, making it a great choice for those looking to reduce their sugar intake while still enjoying rich and creamy textures.
Choosing the Best Cheese for Diabetes

",0,,,,,,,,
"""Heart health is vital for people with diabetes, as high blood sugar levels can damage blood vessels and increase the risk of heart disease,"" says Lorencz. ""Lower-fat cheeses like Swiss, mozzarella, provolone and ricotta are better options for people with diabetes.",0,,,,,,,,
Neem fenugreek is an herbs that heal diabetes,2,,,,,,,,
"The exact cause of most types of diabetes is unknown. In all cases, sugar builds up in the bloodstream. This is because the pancreas doesn't produce enough insulin. Both type 1 and type 2 diabetes may be caused by a combination of genetic or environmental factors.",0,,,,,,,,
"Healthy carbs for people with diabetes include complex carbohydrates like whole grains, starchy vegetables, and legumes. These carbs provide the most nutrition with the least impact on blood sugar.",0,,,,,,,,
"Absolutely, for individuals with diabetes, nutrient-rich carb choices include complex sources like whole grains, starchy veggies, and legumes. These types of carbohydrates deliver essential nutrients while having a lower impact on blood sugar.",0,,,,,,,,
"Can a person be ""cured"" of Type 2 Diabetes? There is compelling evidence that it can, and the solution is simpler than you might think.",0,,,,,,,,
Following a healthy eating plan helps to decrease diabetes.,2,,,,,,,,
Getting regular exercise can help to decrease diabetes.,0,,,,,,,,
"Carbs. Rice, pasta, bread, sweets. You can have them but be very conscious on making sure youÂ’re taking enough insulin. Rice will shoot your blood sugar up dangerously near immediately & extremely.",0,,,,,,,,
"For people already diagnosed with diabetes, green tea may be able to help manage blood sugar levels",0,,,,,,,,
Yes very much. Soaked cinammon water help in reducing diabetes,2,,,,,,,,
Like it's said Diabetes is not a disease it's a disorder!! We can manage Diabetes well with healthy lifestyle and change in food Habits,0,,,,,,,,
Short healthy meals in every 2 hours is the key that keeps a smooth go in Diabetes,2,,,,,,,,
More Protien:Less oil:High fibre:Loads of Veggies: No fry and mandatory work out!! These are the keys to lifestyle and Diet Management,0,,,,,,,,
"keeping these in mind I created the food menu for my family! Here's one from list You all may like stay happy to stay healthy
                    Mix Lentil Cutlets
Quick Ingredients: Small half cup of each Masoor Daal, Chana Daal, whole Moong,and Toor daal, Salt to taste, 2 spoons of  Besan , 2 spoons of oats Powder for Binding  for staying healthy  if you have diabetes",0,,,,,,,,
Olive oil for cooking is best if you have diabetes ,0,,,,,,,,
"Black fennel seeds-100gms, Barley-100gms, Whole wheat-100 gms, 6 glass of water (in 100ml glass)  are the ingredients which helps me to keep my diabetes in control",2,,,,,,,,
"Goodmorning friends!!
Cinnamon water or cinnamon in food really helps People with Diabetes, This is tried and tested measure in my family.",2,,,,,,,,
One of the major concerns for people with diabetes is how to regulate their diet,0,,,,,,,,
We can think of prediabetes as an early warning sign that we might be headed toward diabetes,0,,,,,,,,
The telltale sign is a blood test that show your blood sugar (blood glucose) level is higher than normal but not yet high enough to be considered  Pre diabetes,0,,,,,,,,
A chronic condition that affects the way the body processes blood sugar (glucose),0,,,,,,,,
"With type 2 diabetes, the body either doesn't produce enough insulin, or it resists insulin",0,,,,,,,,
"Black fennel seeds-100gms
Barley-100gms
Whole wheat-100 gms
6 glass of water (in 100ml glass)
Take a bowl mix all the ingredients together add 6 glass of water boil it with high flame for 15 minutes then switch off the flame. Filter that boiled water from those seeds keep it in glass bottle or jar and make them cool in normal room temperature
Next day morning after brush take 1/4glass of that in empty stomach don't take anything till half an hour.Then u can follow ur usual diet food
U have to take 7 days continuously then leave 8 th day then take 9 th dasy then leave 10 day then take 11th day then leave 12 th day then take 13 th day then leave 14 th day then take 15 th day and finally finish that water on 15 th day completely on 16 th day u can check ur sugar level it completely under 100.Clearly note u have to prepare one-time only that water only u have to take till 15 th day.If u got foam after two or three days u can filter and drink.Measurement u have to assume how to keep it till 15 days and drink.I have two abortion bcoz of this diabetes my fetus heart beat got stopped at 12 weeks I felt very bad I tried this and my sugar level was F- 75 PP-99 so I got conceived immediately and gave birth to second son who is now 2 yrs old.U can take 15 days once but pregnant women and in periods time it's not recommended bcoz black fennel seeds nay cause heavy bleeding for pregnant women and at periods time",2,,,,,,,,
Nutrition and physical activity are important parts of a healthy lifestyle when u have diabetes,0,,,,,,,,
"Along with other benefits, following a healthy meal plan and being active can help u keep ur blood glucose level in ur target range",0,,,,,,,,
"To manage ur blood glucose, u need to balance what u eat and drink with physical activity and diabetes medicine, if u take any",0,,,,,,,,
"The key to eating with diabetes is to eat a variety of healthy foods from all food groups, in the amounts ur meal plan outlines",0,,,,,,,,
"Food groups to eat when you have diabetes.The food groups are -vegetables
nonstarchy: includes broccoli, carrots, greens, peppers, and tomatoes
starchy: includes potatoes, corn, and green pea, fruits
oranges, melon, berries, apples, bananas, and grapes, grains
at least half of ur grains for the day should be whole grains which includes wheat, rice, oats, cornmeal, barley, and quinoa
Protein, eggs, nuts and peanuts, dried beans and certain peas, such as chickpeas
Dairy meat substitutes, such as tofu
dairyÂ—nonfat or low fat milk or lactose-free milk if u have lactose intolerance, yogurt, cheese
Eat foods with heart-healthy fats, which mainly come from these foods: oils that are liquid at room temperature, such as canola and olive oil, nuts and seeds heart-healthy fish such as salmon & tuna, avocado
Apart from this what else can be given",0,,,,,,,,
"Diabetes during pregnancy is called Gestational diabetes. There are certain risk factors such as weight, lifestyle that can make a difference. It is not always possible to prevent it. But by reducing weight before conceiving and maintaining it during pregnancy can reduce the risk factor. Healthy eating, and exercising during pregnancy can also reduce the risk factor.",0,,,,,,,,
we have a product to prevent from being diabetic,1,,,,,,,,
If anybody in prediabetic stage we can convert you to non diabetic,1,,,,,,,,
Diabetes is hereditary.mine is my dad mom granny all so got early. diabetes.,2,,,,,,,,
Diabetes is sometimes due to lifestyle,0,,,,,,,,
"Even if you have a family health history of diabetes, you can prevent or delay it by eating healthier, being physically active, and maintaining or reaching a healthy weight.",0,,,,,,,,
Type 1 diabetes is normal and Type 2 is heridetary,2,,,,,,,,
Yes...it is...my maternal relatives are all diabetic..and my mother is also a diabetic...now on my father's side...my grandfather was a diabetic...and my father is also a diabetic...I too had gestational diabetes...so am sure...am going to be a diabetic sooner or later....but I try to eat healthy..and do workouts,2,,,,,,,,
Diabetics are prone for vit deficiency specially vit b12 which affect their nerves n hence pain so it will help can take time,0,,,,,,,,
Controlling the sugar level is the key for diabetes. Get her evaluated again and doctor will adjust her medicines so that blood sugar levels are in control. Half the problems will go once sugar is controlled. Also get her vitamin level chkd.,0,,,,,,,,
Get hba1c test for diabtes before consulting doctor.,0,,,,,,,,
"6% Cumin seeds, 14% cinnamon, 12% Fenugreek seeds, 6% curry leaves, 51% jamun, 1% sesame, 1% lady finger, 3% giloy, 6% kerala can be effective in tretaing diabetes",2,,,,,,,,
Being a sweet toothed I always enjoyed everything in deserts and this causes diabeties,2,,,,,,,,
"What Is Gestational Diabetes?
Gestational diabetes is a condition in which blood sugar levels become high during pregnancy",0,,,,,,,,
There are two classes of gestational diabetes,0,,,,,,,,
Women with class A1 diabetes can manage it through diet and exercise,0,,,,,,,,
Those who have class A2 diabetes need to take insulin or other medications,0,,,,,,,,
Gestational diabetes goes away after you give birth,2,,,,,,,,
"Gestational diabetes can affect your baby’s health, and it raises your risk of getting type 2 diabetes later in life",0,,,,,,,,
"Symptoms
Women with gestational diabetes don’t usually have symptoms or may chalk them up to pregnancy",0,,,,,,,,
Most find out that they have diabetes during a routine screening,0,,,,,,,,
"You may notice the following if you have diabetes:
You’re thirstier than usual
 You’re hungrier and eat more than usual
You pee more than usual
Diet and Exercise for Gestational Diabetes",0,,,,,,,,
"Take these simple steps to stay healthy during diabetes:
Eat a healthy, low-sugar diet",0,,,,,,,,
Follow a meal plan made for someone with diabeties,0,,,,,,,,
Talk to your doctor to be sure you’re getting the nutrition you need when you have diabetes.,0,,,,,,,,
"Trade sugary snacks like cookies, candy, and ice cream for natural sugars like fruits, carrots, and raisins when you have diabetes.",0,,,,,,,,
"Add vegetables and whole grains, and watch your portion sizes when you have diabetes.",0,,,,,,,,
 Exercise throughout your pregnancy when you have diabetes.,0,,,,,,,,
Get active as soon as possible when you have diabetes.,0,,,,,,,,
Aim for 30 minutes of moderate activity most days of the week when you have diabetes.,0,,,,,,,,
"Running, walking, swimming, and biking are all good options when you have diabetes.",0,,,,,,,,
"Get appropriate prenatal care: Not only can your doctor screen you for this condition; she can offer advice on food, activity and weight loss",0,,,,,,,,
" Gestational Diabetes Prevention
You can lower your risk before you get pregnant by:
Eating a healthy diet
Staying active
Losing extra weight",0,,,,,,,,
"Diabetes, is a metabolic disease that causes high blood sugar",0,,,,,,,,
